{
  "$schema": "https://caatuu.org/schemas/android-assets.v1.schema.json",
  "schemaVersion": 1,
  "courseId": "cz",
  "nativeProviders": {
    "schemaVersion": 1,
    "providers": {
      "embeddings": {
        "implementation": "vector-database-catalog-v1",
        "resource": "embeddingCatalog"
      },
      "dictionary": {
        "implementation": "sqlite-dictionary-catalog-v1",
        "resource": "dictionaryCatalog"
      },
      "speech": {
        "implementation": "android-text-to-speech-v1",
        "localeSource": "targetLanguage.speechLocale"
      }
    }
  },
  "files": [
    "case-cosmos.html",
    "icons/caatuu-czech-192.png",
    "icons/caatuu-czech-512.png",
    "manifest.webmanifest",
    "setup-assets.json",
    "source/features/dictionary/dictionary-full.js",
    "source/features/dictionary/dictionary-gap-report.mjs",
    "source/features/dictionary/dictionary-patch-core.mjs",
    "source/features/campaign/campaign.css",
    "source/features/setup/setup-progress.js",
    "source/features/setup/setup.js",
    "source/games/case-cosmos/case-cosmos.css",
    "source/games/case-cosmos/case-cosmos.js",
    "source/games/case-cosmos/case-cosmos-content.mjs",
    "source/games/case-cosmos/case-cosmos-cs-policy.mjs",
    "source/games/verb-nebula/verb-exercise-family-core.mjs",
    "source/games/verb-nebula/verb-nebula-core.mjs",
    "source/games/word-world/word-net-standard.mjs",
    "source/language/adapter.mjs",
    "source/shared/child-facing-assets.mjs",
    "source/shared/course-profile.js",
    "source/shared/feedback-outbox.mjs",
    "source/shared/runtime.js",
    "source/shared/vector-db.js",
    "sw.js",
    "vendor/sql.js/LICENSE",
    "vendor/sql.js/README.md",
    "vendor/sql.js/sql-wasm.js",
    "vendor/sql.js/sql-wasm.wasm",
    "vendor/transformers/LICENSE",
    "vendor/transformers/README.md",
    "vendor/transformers/transformers.min.js",
    "data/dictionaries/ATTRIBUTION.md",
    "data/dictionaries/README.md",
    "data/dictionaries/catalog.json",
    "data/dictionaries/reference.html",
    "data/dictionaries/kaikki-cs-en-2026-07-09/manifest.json",
    "data/dictionaries/patches/reviewed-cs-en.v1.json",
    "data/embeddings/all-minilm-l6-v2-qint8-v0.1/manifest.json",
    "data/embeddings/models.json",
    "data/games/grammar-gravity/content.json",
    "data/games/grammar-gravity/nouns.json",
    "data/games/case-cosmos/content.json",
    "data/games/conjugation-comet/content.json",
    "data/games/sound-quasar/content.json",
    "data/games/verb-nebula/content.json",
    "data/games/word-world/manifest.json",
    "data/games/word-world/content.json",
    "data/language/scripts.json",
    "data/games/memory-moon/content.json"
  ],
  "launcherIconFiles": [
    "coin_icon_ui.png",
    "czech_flag_ui.png",
    "dark_mode_ui.png",
    "difficulty_medal_1_ui.png",
    "difficulty_medal_2_ui.png",
    "difficulty_medal_3_ui.png",
    "light_mode_ui.png",
    "paper_plane_submit_ui.png"
  ]
}
